Review-Text,Review-Date,Star-Rating,Web-Site
"Firstly the parts of the car is not at all good, what I come to know later is that this company is a Chinese one and just to make mark in India they registered as UK based company which is very much false. If you can check in the internet you can come to know that Chinese hold major shares in the company and the parts used to build the car is manufactured in China which you all know how quality will that China cheap parts be!","July 26, 2019",1,carwale.com
"Hello,         Myself Dr Hasan Faraz,   It is very heart broken to say that i have Happilly Book MG Hector    On 27-6-2019 , Red, Diesel Super 10 Days Later i got call from company saying company is not making Red In super variant ( then why did they done my booking , i have written proof for that) I compromise with White Color Now White super Diesel 10 Days Later again i got Call as i Have changed my Variant Color i will be getting car in October( it was not me who changed variant they forced me ) Now few Days Before i Got Call i will get my Car in December . I thing MG Motor is cheater and Cheating me  I also came to know that my car is wrongly feed in computer by Red petrol, which i asked to correct many times with no response in return,    I am  very dissapointed by the service and assurances i get from MG They cheated me , i sold my car on there promise now without a car i only know difficulties i am going through in my practice .     Totally heart broken with wrong promisses i had no choice but to write a letter, Kindly Help  Booking id  - NE0****135   Kind regards,  Dr Hasan Faraz  Ph- 9*******559  Lucknow , UP","August 14, 2019",1,carwale.com
"MG HECTOR is one of the best and fully loaded SUV, which was provided at lower cost in all variants. Ride quality and looks also good. Comfortable seats, paramonic sunroof, inside internet and AC performance fabulous. . .","July 06, 2019",5,carwale.com
Pls don’t buy this car .. there is problem in clutch plate and that is not getting to solve .. making fool . Just the looks given in car .. performance vise very poor .. I will suggest go for Kia motors much better .. I am regretting buying mj hector,"August 20, 2019",2,carwale.com
"Buying Experience: Only one dealer in entire Telangana and most of the staff is straight from college. Over & above overwhelming bookings . Now you can imagine the customer experience. Heard some customers are using all possible recommendations to speed up their delivery. You can imagine the rest. Riding Experience: I drove MG Hector (Sharp) Petrol Hybrid for more than 1000kms. Both in city traffic (200km) and on national highway (800km). It gives superior comfort for driver/passengers . HiTech features makes you feel like you are in full control of the car. No complaints in this section. Over all I am very happy. Details about look: I liked the external design of the car. For me it appears like a mini Toyota Fortuner from some angles. Performance: After driving it in different roads in city & highways, I don't feel the acceleration is leaner enough in all gears. Overall I felt it is ""sluggish"" / ""under powered"" . I am not an auto expert to give figures on RPM vs Torque etc. Even the fuel efficiency is not up to the figures declared by MG India (i.e. 15.8 kmpl). I only got 9 to 10 kmpl in city & 11 to 13kmpl in Highways. Finally I would like to say this car is a good value for money.","September 11, 2019",3,carwale.com
"I got a chance to Drive this Car . I didn't Expect That the petrol Hybrid Engine Gives This Type of power. This Engine Really Awesome. The 1.5 ltr Hybrid Engine Gives a lot of Power in the Mid-range Up to 2000 rpm some amount of lag but its pull so Quickly. And The safety features of this car is Very good 6 Airbag Abs EBD TC Hill hold etc. The Design of this Car is Awesome And The comfort also Very Good The Rear Passenger Gets Rear Arm Rest Rear Ac Vents and Good Amount of Space. And The Main Attraction of this Car Internet Inside 10.4 inch Huge Touch screen It's Really Awesome The Sound Quality Is Also Great . Pros 1. Value for Money 2. Fully Loaded By the Way of Features In this Price like Panoramic Sunroof, 10 inch Touch screen With Android Auto And Apple Car Play With 5G Sim Support, Electrically Adjustable Driver seat Etc 3. Safety Cons 1. The Breaking is Okey Not that Great","November 06, 2019",5,carwale.com
"The overall genuine review must-read who want to buy this car 1. My buying exp. Is awesome the showroom people were very polite and responsible. And I opted for black mg hector top-end diesel 2. I have already done 20000 kms in 4 months and at first, there is a clutch issue and I thought this was a bad car but it isn't the company replaced my clutch with a dust cover not it is riding excellently and on Hyderabad ring road I've hit 185kmph and it feels like going 100 kmph inside the cabin there is 0 vibration and noises....overall very nice. 3. The looks were Mind boggling just awesome the black was insane.when it comes to performance in 2nd gear the power was lacking but overall the performance was brilliant absolutely no doubt 4.pros and cons PROS *Stunning looks *Great power *Roomy cabin *Amazing features *Cheaper price for that car i would pay min. 25 lack for that car CONS *STEERING WOULD HAVE MORE FEEL AND FEEDBACK BUT ITS FINE WHEN WE GAIN SPEED. THAT'S IT.","December 09, 2019",5,carwale.com
"Mg hector is one of the best suv segment car in india.it is basically competition with harrier,creata and jeep pros:it has good pickup 2.it has smooth drive. Cons:1 isssue with voice command either it doesn't recognize or it listen to what you talks 2.display touch -it display is not responding sometimes 3.cooling issue in the rear section ac is not much effective as it has panaromic sunroof it has high temperature in rear section cooling is not effective in summer. 4.battery is not so good thats why mg provide one year warranty on that.","July 25, 2019",3,carwale.com
"Buying experience: Sales number define the gravity of the car and flock of customer booking. Riding experience: one of the worst experience as the acceleration is worst in the segment. I bet if you take this in traffic it will take her two second just to respond. Details: well tough it's an internet car and first in the segment. The only feature enactment is voice command worthy enough to test. Well didn't they just fit an ipad. It feels like a copied version. Also the screen frickles while it was standing at showroom they ac touchbar went flickering. It's a common thing for a car to have a dc electronic convertor for a car standing at showroom but this happed with the car too. Maybe they require a software update the right side, the bonut is not aligned to the body. So there might be an assembly issue to with the car. Honestly, I went to buy with confidence. But that engine ruined by decision. It's not responsive at all. And the assembly thing might cause vibration in future with my experience.","July 10, 2019",3,carwale.com
This car is nothing but a cheap quality chinese car the petrol hybrid version is waste and its lack much power .... This version of the car is low on power and according to the massive expensive price range .... Jeep compass is much better option .....I was thinking of selling my jeep compass when i saw MG but after riding it i regret my descision ..... I chose to keep using my jeep compass for another 1 year instead of buying This RUBBISH MG HECTOR ...... FIRST of all this same car is provided to different car brands in the world so it no unique This car is provided to the Brands like CHEVROLET BAOJUN 350 WULING ALMAZ Type this on net and you will find this same car with different badging ..... I REGRET EVEN DRIVING IT ......IN the end its your money your choice .....,"July 01, 2019",1,carwale.com
Full Luxury car with all features Best in Class But Diesel has some problem Fuel pump noise after Long drive Engine different noise like something That touching in starting time This noise you found the noise when the glass is down You found dashboard sound MG Looks at this type of problem N solve it to make this car no 1 All this type of problem I see when meeting one of mg customer he live in noida He buy this hector diesel top model from agra He have red hector facing the problem of noise when he start the car Sound of fuel pump And also after 3 months gone the registration of his car is not done after paying the advance registration fee I found at the time of test drive Dashboard sound Mg must go through this type of problem which his customer is facing,"September 18, 2019",5,carwale.com
"This is a China car I have used this car for a short period of time for one month and there were some small scratch on the bumper while driving I scratched a small post and I wanted to repair it so I went to the MG work shop and I asked a claim in the warranty and they refused it and they said that paint is not included in the warranty and I asked the price for painting they said it is 50,000 only I got angry and I left the place and I can’t accept that for a cheap China car I should give this much money this car is not worth and it’s cheap plastic interiors and I exchanged it and bought a Honda CR-V","July 22, 2019",1,carwale.com
"This car being new entrant has been set at the right price between Creta and Harrier. Comparatively has a lot on offer especially features and technology. Really like the tire temperature indicators. UI on main head unit is a bit slower. Hope they will update it soon. Not very good for offroading as the over hang is too much reducing approach angle from both ends. Tired are a size smaller compared to the overall size of this SUV. Bus quality is very good and have passed crash test with 5*. Overall it's at the best price. Long term reliability is still a question mark and to cover that MG are providing 5 years unlimited mileage warranty, I believe that comes at an add-on price.","June 29, 2019",5,carwale.com
"I'm honestly advising not to buy this car right now. Connectivity feature is a crap.Poor build quality. Touchscreen is really lagging.Voice recognition not working best as expected. Comfort and space is awesome. Keep in mind it's not like a SUV, it works like an MPV. Harrier is he best alternative","July 15, 2019",3,carwale.com
"I have booked this car in June in Gurgaon after reading review at CarWale.com before they announced even prices and they told me that they will Delever car by July and took our advance , now they say that they will delever in September and there is no reasons , They are selling cars by taking some premium and this is my concern I am thinking to cancel it now","July 25, 2019",3,carwale.com
"Worst Car, The mileage in city is 6.1 on highway 7.2, Huge power loss when you want acceleration, AC not effective, worst experience while driving uphill, please don't buy, also recommended to cancel your booking, if you want a genuine test drive please mail me at mayank@%*%%***%*.**.in","July 27, 2019",2,carwale.com
"I was reading the reviews mentioned on the portal and there was one review by Mr. Nishant Rao who claimed to have bought the car 2 weeks before the official deliveries started and gave full detailed review explaining how everything about this car is negative. This was a classic example of negative marketing from the people associated with other brands. MG has done a commendable work to start their innings in India. They are providing a extraordinary package with the aggressive pricing. It remains to see how the car performs and time.shall make it clear. As of now, Hector is quite impressive. P.S. beware of fake reviews","July 15, 2019",5,carwale.com
"It’s over priced by company after waiting Of 3 months. No one Trust new company in India. They should make prices lower to Hyundai creta etc., since people don’t hv experience Smart India Smart people",,1,carwale.com
"I booked MG hector on 19th of July, 2019. I opted for Smart DCT, (Aurora Silver) at MG’s Showroom Ahmedabad which is owned by Concept Motors. I had driven MG hector before booking the car itself. But after booking it I still wanted a test drive. I was with the same Sales person from whom I booked the car. I was just cruising around on the service road, when there was a sudden thud in the engine. The car stopped immediately after that. I had to put it in 2nd Manual so that car started moving again. There was no response from the car in any other gears. I tried to manually adjust in 1-3-4-R none of them worked. In any of the gears other than 2nd I would see an orange coloured exclamation mark on the information cluster. The sales person told that there was some issue in the transmission. He called some guy from the tech team and found out the transmission had failed. The car had only 4200km on the test runs. I cancelled the booking very next day to which their manager told me to wait for a few days until we find what the issue was in regards to. But as I was adamant they proceeded with the refund. While booking they had promised to refund in 15 days though it took them 28 days to process it through and give me the cheque that too after alot of follow ups. The car is good on cosmetics, but I don’t think so that you can rely on the engine in the long run. MG still needs to refine the Engine according to the Indian roads. Giving variety of features won’t help if there is an issue with the Engine Quality.","September 09, 2019",1,carwale.com
"It's a beautiful suv design wise, no doubt about it. However the steering control is poor. The screen doesn't respond properly to the commands. Tyres look very small. Interior finish is ok type. Driver seats are adjustable but not comfortable. Worst part is the curtain of sunroof, which looks like a mosquito net, very thin. Front and back parts are made up of cheap plastic. A true Chinese product, you will be lured by beauty but actual performance is poor. Less service network, nil resale value.","June 28, 2019",3,carwale.com
It's look is amazing. It's engine is too powerful. It's suitable for me for long and short trips. It was very easy to buy it. It is too much smooth to drive. I would recommend everyone to buy MG Hector.,"July 05, 2019",5,carwale.com
Good interest features but engine performance not good as harrier and jeep compass. And design is not good as tata harrier and jeep compass Good interest features but engine performance not good as harrier and jeep compass. And design is not good as tata harrier and jeep compass. I suggest u to buy harrier,"August 14, 2019",3,carwale.com
Looking amazing a really a smart car a wonderful er car. I want to buy . No competition no comparatively in this budget. the ride is the very comfortable price is very low and features is very excellent....,"July 04, 2019",5,carwale.com
It was good to have the car. Great comfort and style. Family is enjoying the ride during long drives. Safety is a plus point for this new machine. Colours are eye catching and vibrant,"September 10, 2019",5,carwale.com
This car is amazing looking and fetures when i saw tha car first i found a very stylish looking car at this time unbelievable price waiting for buy the car i want to give this car to my girlfriend on her bday,"July 26, 2019",5,carwale.com
"Amazing Car looking true SUV that true value of money I hope hector archive all milestone this is new courage of SUV loverrrrrrrrr , looking like a hector new hero of suv cadre.","July 18, 2019",5,carwale.com
This is the best car under this price it come with full feature loaded suv under 20 lakh and gives a tough compitition to cars of this segment. The app control the style body design build quality and mny more other features make it a perfect car. The large and Huge panoramic sunroof is awesome the touch screen the 360 degrer parking camera i am in love witj this vehicle,"July 05, 2019",5,carwale.com
It was quite exciting and joyful experience driving this amazing car.it is fully paisawasool car.looks are quite good and modern.tecnology car. It is fully paisawasool car and one should go for it,"August 14, 2019",5,carwale.com
"It’s great price to buy compare to Hyundai venue, Honda BRV or Hyundai Creta I love the panoramic moonroof DCT Petrol power with turbo charge . Best view and ground clearance is perfect","August 24, 2019",5,carwale.com
"No doubtly this car is going to shake the whole market because it has more features ,but overall the IMHO I do not liked the design at all I still consider harrier or compass is better that how they looks This car is filled with a lot of features But sometimes these features will annoy you Like ""hello MG "" These are all gimmicky things to attract more and more audience.. Infact the seating of harrier is way better than the Hector Underthigh support is missing And the elements are copy from other manufacturers too! Like the rear is fully copied from Audi The infortainment system copied from Volvo Instrument cluster copied from Aston Martin To much coping from each other And at the end CHINESE ARE FAMOUS FOR COPING THINGS Overall the car is decent not so great .","June 30, 2019",3,carwale.com
Great good looking in any others cars low cost of maintenance very carefully futures in this vehicle very comfortable in car awesome tripe tk manli no any other person like this one is the best thing Air-condition is cool one someone that has been checked my first choice to get back in touch soon,"July 31, 2019",4,carwale.com
Yes I would consider to buy this car Very good in terms of driving experience Top end modle has good safety features with very low price range it's a budget friendly car New in market so can't say about it's service and maintenance Highly equipped with Good safety features budget friendly car Safety comes first,"September 10, 2019",5,carwale.com
Look wise so good and performance is also better than other SUV. This car fuel efficiency is better than other same segments. The car is totally awesome. Loads of features and competition to other brands. This car being new entrant has been set at the right price than other cars. Overall it's at the best price.,"July 04, 2019",5,carwale.com
Little long waiting period but worth to wait awsum sun roof interiors and Bluetooth systems which makes it completely flawless. Best in Mileage also adds up to stylish looks and comfort wise also,"July 23, 2019",5,carwale.com
"Its look is amazing, interior super and in Indian markets first internet car , overall this car worth to buy ,but I am waiting for 7 seater, ok thanks to MG for a super duper car , When to expect 7 seater in Indian market , please let me know , i am huge fan of mg , Does MG Hector consist of a Hybrid variant","August 14, 2019",5,carwale.com
I just want to say this is the best car and it's worth buying this car.....price is awesome....instead of investing of fortuner or creta buy this Its is a new car just planning for a long drive .....I hope I get a good service,"July 23, 2019",5,carwale.com
It's looking very nice. Spacious. Very fabulous. According to price this car is value for money. it's real XUV car. I want to suggest to all users please please when you plan to purchase car in 12 to 14 lakh so first see it.,"July 07, 2019",5,carwale.com
Excellent car for a family purpose. When I saw this car at a first time I was attract towards it. It's interior and exterior both are excellent. Or I was not soure about the engine.,"July 11, 2019",5,carwale.com
Its really awesome car made by morris garage... M waiting to purchase it...m waiting to launch in goa soon... So soon i buy it. I love its amazing with features nd internet connection...love it,"July 06, 2019",5,carwale.com
I'm from a small village in rajasthan. I like this car so much...some peoples see MG Hector in advertisements on TV. After knowing its features many peoples like this & want to replace his cars with MG hector...its voice controlled system is great....really I recommend everyone to buy MG Hector. I also want to buy this one after 1 month. Then I will update my review with all my experiences. Without touching this car I m confident mG Hector is best....thank you.,"August 10, 2019",5,carwale.com
A very nice and very intelligent car. I reccomend you to buy this car This is a pretty and awesome looking car. Best car to buy and we can give upto a 100 of commands and it will follow...,"July 21, 2019",5,carwale.com
It's an excellent car with a lot of features. And the price is too low compared to the features and facilities. I had driven the top end diesel model car. It is very comfort to drive long kilometres(long drive). I would like to buy it but the booking is now stopped. Its a superb car a small family and its boot space is the main highlight,"August 04, 2019",5,carwale.com
"Hi, i am Intereating MG Hector, last one month i watching mg hector in youtube all model. My experince this mg is the best car. I hope and i buying this car between 3 or 4 months. MG Hector model deserve inthe best model really i like this car and i Fainlly deceided buying this car and Comperison another cars","July 31, 2019",5,carwale.com
It's awesome...best one in this price. No doubt in it ....it have good specifications. India's first internet connected car . So many service center also there .I will suggest this one .,"July 09, 2019",4,carwale.com
"I love this SUV it looks very sharp and comfortable and is so fast and the company is giving good service Jai Shree Ram.The car is so features like 360.degree camera.it is better than scorpio ,harrier.","July 21, 2019",5,carwale.com
"It's seems like very good, worth of money I would like to prefer you all to go through this car once. Buying procedures takes little bit of time, but overall I think it is good. Best for the long journeys in this price ranges of SUV vehicles. Better than orther SUV vehicles. It's look is good enough and have one of the best look in this price range, it's colours textures are good, colours variant are also good. It's overall look is very good. It's headlamps and backlamps are look very gorgeous and stunning. It's curved edges looks very smoothy. It's performance is best in it's class. It have a very efficient engine installed. And its driving experience is smooth enough. Fuel economy is also good enough but it can better. In India not a many service centers for this car are available but it will be available soon as I think of. Servicing experience of mine are good enough. In case of price range this car's maintenance cost is not so costly as others in comparison. It has very attractive features like very efficient voice command control which can control many of its features. It has a large display which feel premium enough. And all of the others features are available. This car is one of the option in case of comfort.","July 04, 2019",5,carwale.com
"My Friend purchasing Mg hector Petrol Really Awsemone ,Smooth. Moving Interiro Body ultimate ,I suggest please Blindly purchase this Car otherswise They are Unlucky,My Freind But this on 8july 2019 Really after that they run car in hill station and in City roads totally 2400 mileage Complete,thats it","August 07, 2019",5,carwale.com
I intrested purchase mg hactor Very smooth driving and comfort All intirear fiturs smart looking This car all side looking the sporty and stylish millese and servicing mantinese I like good performance and very powerful engine and very smart style panorama roof sitting is very comfortable all side I like this car,"August 20, 2019",5,carwale.com
"This car is not good in long drives.and also there is no Android auto or Apple car play.there is only a huge tablet with some waste application like Tom Tom map.only the pros is connected features. Just go for Tata harrier,Kia seltos or Jeep compass.and also the panromic sunroof of mg Hector was good.dont go for this Chinese product.","September 06, 2019",2,carwale.com
What a nice car its car features is osm and the more stylish car in india i will drive first time i am big fan of mg hector and its interior nice i purchase in disel variant manual,"July 06, 2019",5,carwale.com
"Except rear seat width every thing looks good, good quality materials ,driving comfort,feature loaded are excellent.only the thing is after sale service and maintenance ??or ??","July 04, 2019",4,carwale.com
Super interior and very good quality I like it very much it is simply superb I'm thinking it is best car for normal people it has good interior and best desine and best fuel economy,"June 30, 2019",5,carwale.com
The mg cars are very beautiful. Design and are very advance. These. Cars are my favorite. experience is good service and maintenance are well. Buying. This car is my ambition to buy this cars. I love mg and all who buy mg,"July 04, 2019",5,carwale.com
Best car in 2019  best voice commands Feature loaded species & comfort boots space very well Tyres is so little small but overall very good product best buying  M G are demand & selling not be balanced ??,"July 26, 2019",3,carwale.com
This car is damm cool.once you go out in this bad boy people stare at you like whatever. It's not a car it's means a lot to me. Blindly go for it.as I had personally checked the car. Their is no doubt that it's the best car in this price segment. and I even don't see a car comparable to it in higher segment also. I purchased this car from sec-8 noida showroom the staff is really good and helpful. The person from whome we purchased car is always ready to help.,"July 29, 2019",5,carwale.com
"It's a wonderful car. It's a very comfortable and spacefull interior design, as well as, as a driver it's giving a luxury feeling. MG Hector is one of the best SUV I aver drive, it's a huge fantastic.","August 25, 2019",5,carwale.com
