Review-Text,Review-Date,Star-Rating,Web-Site
This is the first car in india. I like the car. comfert is very good. I'm very interested in the car. I'm drive the and I'm so impress this car. It's size very Good for Big ride. I'm Loving this car.,"September 14, 2019",5,carwale.com
it's bull....don't read just try test drive...for this budget this best and more enough....pls take it seriously....it's better not belive others try ur part ...u will be surely convenced......even majer things car is very much stable at the time of driving faster ..which only PREMIUM car proves...not like budget car,"August 07, 2019",5,carwale.com
Only about looking n performance on road. I want to see maximum cars on Indian road Common people can also riding experience . People are more in lines n always fulfill the customer requirements time to time I thing that common people can also purchase of this dream car. Always commitment to great service from MG motor,"August 15, 2019",5,carwale.com
I had nice experience with this vehicle.. it is just like inside a wonder world with lot of energy to do anything... Materials used in interior is high quality and it gives more comfort and stylish look. E assist is very nice to communicated.. Engine noise is not come to inside and fully noise proofed.,,5,carwale.com
Drive Hector with Fully trust because smart people ki smarat car meand MG HECtOr. Unbelivable feature and Unbelivable car wchich introduced in indian market.I hope no one can beat these car at these budget.Hope i will buy my first car whenevr will go for Hector. Its dream car of my life and i always try to fulfill my dream.,"August 15, 2019",5,carwale.com
"MG Hector is a very impressive SUV with a sleek look and it's imposing texture. It is comfy and smooth. Though this amazing car weighs 2 tonnes, it has a good pick-up. The engine is powerful and the cabin in quiet. There is a lot of leg room for second row. The boot space is remarkable. The car come with one of the best infotainment systems.The voice commands take a little time to activate, but still are impressive.The car has wide wheels which increase the road grip. The fuel efficiency/ milage is not that satisfactory The top varient is quite expensive but it is worth it.The dealer told me that for Rs.30000, they will take complete maintenance care for 3 years! The infotainment system comes with a prepaid 4 year subscription. So, u r connected with internet anywhere u go. The panoramic sunroof/moonroof is breath taking and makes us feel good. In the top varient, u get a 360° view, top view, side view, et cetera. My driving experience was excellent but we don't know about the OFF ROAD Ability of this car. The only matter of concern is that it is a Chinese car n many Indians don't like tat","September 06, 2019",5,carwale.com
"The car is totally awesome.Loads of features and good competition to harrier and xuv500.The car is equal to jeep compass,so its worth buying it.Only problem is these cars are BS4 engines and the delivery of car is nearly on year 2019 ending.Else the car looks,performance and features are really good for that price.","June 29, 2019",5,carwale.com
Best car in this segment amazing car I think this car is better than harrier this car have many features than Tata harrier front look is but mg doing a good job . This car have amazing look with amazing features.,"August 08, 2019",5,carwale.com
"This car is amazing as because its from MG motors.. i have not bhought the product yet but its in my wish list to buy MG car hector . As this car provide us the futuristic technology and the look of we indians expect like US cars, the MG motor has completed our expectations buy bringing such a beauty to indian roads... Well according to my research on youtube i have got to understand that the quality, performance, practicality,riding comfort is best according to the price range . Servicing and maintenance might be higher side as afcourse its MG but its worth it. But there a few things which can be rectified by MG are there lag in music system, low light in spedo meter,back seat underneath support well yh thats it ... Eagerly w8ing for sedan car by MG ..","August 08, 2019",5,carwale.com
"Great features. Strong built than Harrier,xuv500 and Compass. Spacious than all its competitors. My hector is coming in September . Hector is going to defeat all its competitors In sales in upcoming mnths may be from August only. This is only a car with voice command in its range. Land rover costing above 50 lacs will give you this feature. Finally it's a fantastic car.","July 02, 2019",5,carwale.com
I test ride the vehicle and it’s awesome.... interior design is bit okay but the technology is smart in its kind.... Audio playback seating aitbags and many more especially the voice assistant is nice,"August 27, 2019",4,carwale.com
"Pros: Loaded with fancy features , not sure how long they will work. Cons,: Worst customer service, Chinese made and yet to prove itself which is highly doubtful considering the Chinese made sticker.","July 24, 2019",1,carwale.com
"The delivery is very nice and riding experience was awesome and good performance of the engine. pros: eye catchy Nice driving clearence, good seat height adjustment.","August 23, 2019",4,carwale.com
"I drive the MG hector that has many features in it, and it has a lot of performance and it is very easy to use and it is comfortable in the drive. And I think it will become the most famous brand in the upcoming Days.","July 17, 2019",5,carwale.com
I booked a car on july 4th at Naroda dealership. At the time of booking the sales person confidently gave time to deliver car in 2 to 3 months which means mg committed to give car in mid of October. After booking i got call from mg motors that i will get my car in December. Which is double the waiting period. Inshort. Mg motors made fake promise about delivery date and made wrong commitment. Now after 2 months mg motors is saying that you need to wait for 4 months more. So disappointed. A new car maker which i trust have broken it. 1st car. Going to cancle the booking. Will never ever buy MG Cars,"September 11, 2019",1,carwale.com
A very amazing suv to drive on ... So comfortable and luxurious inside and stylish outside... Such a nice car at a very affordable price Powerful engine with best performance.. Overall fully satisfied...,"July 06, 2019",5,carwale.com
"It's value for money, it's performance was well, it's with u all the time, it's a human being, it's having a such gud features. Comfortable ride compare to others having well safety, like AIR bags.","September 11, 2019",5,carwale.com
This car is value for money and they could have given an hydraulic for the bannet it will be very useful because the bannet heavy other all features all good and unique the internet connected car voice assistance and many more other features in the car like electronic tail gate,"July 17, 2019",5,carwale.com
One of the most awaited car i have waited with so much of patience finally a prayer heard by the automobile sector with an eco friendly car with an hybrid feature just love the muscular body with smart features like an smartphone user friendly suv one much have car for all the new generation guys it suits all the generations requirements with style and passion thanks MG to getting in to India market,"September 15, 2019",5,carwale.com
Nice car in low budject. Nice 360• degrees camera. Large space inside the car. These gares are very comfortable . Riding experence is very very happy for me. Looks are good performance. Low maintenance charge.,"July 08, 2019",5,carwale.com
Superb car my favourite car look is a very superb exiting car hector is powerful car so comfortable to long tour and family both are like a car family used car by a awesome car and purchase car and my dream and should be a not money please test drive is better and top car and pickup is so good like,"August 27, 2019",4,carwale.com
This is amazing car ever in my life I have Volvo&s-cross also but this is amazing car.i love it superb Man it's wonderful.,"September 07, 2019",5,carwale.com
"This car is way better than Tata harrier. The only downside is its a new company and service network. But they told me that they will open showrooms in tier3 cities soon. Coming to the car , the diesel is the same as that of harrier but produces 30 bhp more and claims more FE than harrier that is a win for me. Also even the base model is equipped with hill descent , ebd, and everything that is equipped in the top variant .. it also comes with the factory fitted music system which is not in tata harrier. For the money you pay this has the most value. Also riding comfort is better. Harrier looks funky whereas this looks professional. If they open showroom near my town, i would definitely buy one. Waiting.","June 29, 2019",5,carwale.com
Awesome service from service centre no maintenance good mileage awesome car interior design ideas so good also equal to toyota fortuner nd ford endeavour in look its headlight are good,"July 08, 2019",5,carwale.com
"Everything is very good, showroom service was excellent, Very very sporty look. Display screen and sunroof is something like newly added technology like luxury car. Only missing thing is it could be 7 seater.","July 17, 2019",5,carwale.com
Test Drove the 1.5 Sharp Hybrid Petrol Manual variant. Went to Navi Mumbai showroom last Sunday morning and very quickly was slotted for the TD. From Nerul took the Sion Panvel Highway and drove up to almost Thurbe and back. Accelaration was quite rapid in 3rd gear. went over no -road surface service road near Shirvane. didnt feel the roughs at all. Overall good car. I have booked the Smart Hybrid.,"July 29, 2019",4,carwale.com
"OMG...I got shock then i took one look of this incedible car.. this car funtabulous... every think that i need.. it have..,,not that much costy...look and performes vise better than others , i recommed to myself..to buy this one","July 04, 2019",5,carwale.com
Riding experience was excellent and the price was very worthy. Fuel mileage was good. External body was very good.Engine was smooth during riding and seating comfort was very nice.,"July 12, 2019",5,carwale.com
Buying experience was very good the salesman conveyed the features in soulful manner. Riding experience of the car was outstanding. the first look of the car was it's appearance was too good Like service cost was minimal on only up to 10000 I think this car has no cons only pros that is it's features.,,5,carwale.com
"This car is way better than Tata harrier. The only downside is its a new company and service network. But they told me that they will open showrooms in tier3 cities soon. Coming to the car , the diesel is the same as that of harrier but produces 30 bhp more and claims more FE than harrier that is a win for me. Also even the base model is equipped with hill descent , hill hold, ESP,cooled glove box,TC,rear defogger and wiper which is a great security feature on hill drives,keyless entry etc .. it also comes with the factory fitted music system which is not in tata harrier. For the money you pay this has the most value. Also riding comfort is better. Harrier looks funky whereas this looks professional. If they open showroom near my town, i would definitely buy one. Waiting.","June 29, 2019",5,carwale.com
Cool car..i loved this car.. Love it. I recommend it to buy this car. Also it's our young ages car.this car display is massif. Also it has a lot of features Jiska seat comfort is best of the segment. This guard has wonderful colours variance this ka room space is Messi top of the signet also discard boot space top notch,"July 27, 2019",5,carwale.com
"Far ahead of its rivals(harrier and compass) in features and space..high comfort level.. good for comfort and safe driving lovers....not good for harsh riders bcz of its height, car ill topple in sharp cuts ...engine wise same as its rivals 2.0 fiat engine so no compromise ..over all good and fully loaded car with good price tag","August 16, 2019",5,carwale.com
This is one of the most futuristic car in this segment.and u feel in the car very luxurious feel gives u.i ts value for money.but one thing it's look like very big SUV but it 5.seater SUV car this is Disappointing me but otherwise nothing to say about it........,"July 19, 2019",5,carwale.com
Looks is very nice and fabulous front looks overall and interior is also excellent very spacious for passengers Nd LCD was amazing steering design very good but one thing is I don’t like is that desiel engine is car starting sound is not good that’s it nice car,"August 02, 2019",5,carwale.com
Amazing car at this price. This car has lowest price. This is very soft to drive and when also on long with rest in car And i like internet car. Car say hello our when we get in car,"July 04, 2019",5,carwale.com
1st of all showroom staffs are very polite and give each and every i formation about this vehicle * i cant say anything about riding experience because its a just feeling when u ride u felt its premium ness * by look it has a unique design and attracts everyone by exterior as well as interior,"July 17, 2019",5,carwale.com
Good car gives mileage of 13 in petrol variant. Exterior is good but interior looks simple but not bad good quality work has been done fully led looks so dash. But dont buy the lower variant cause best value for money starts from smart. Thanks??,"July 14, 2019",5,carwale.com
Very best car i every drive this car is to good looking It have very very powerful engine the have very comfortable seat I wish i can buy this car And gift to my dad and mom Best part of this car is sun roof and voice control And big boot space and big weels and dinamic body and beautiful light One day i will buy this car,"August 30, 2019",5,carwale.com
"Carwale app is the best. I think, This MG HECTOR is the best choice because, the interior is best in segment, this car is loaded of features like 10 inches horizontal touch screen, app feature, voice commands, inbuilt internet and panromic sun roof, that makes this SUV Incredible. This SUV is best..","August 16, 2019",4,carwale.com
It's an awesome car.... comforting price for medium family.. it's an very difficult to other cars.. performance good but wait and see for another review after 6 months... Thanks for MG,"July 10, 2019",5,carwale.com
"I bought MG HECTOR on 10 July 2019 really it performs very well... I drove it more than 3000 kilometres in city, Highway and Hill Station also it felt very Nice it's a fully packed family SUV.... please don't think more just go for it Blindly..don't compare with any other vehicle or Brand it's it's too far from that all... in all the way like Price, features, build quality,performance and warranty.....more n more just go for MGGG Blindly that's it.","August 05, 2019",5,carwale.com
"Well looks n sitting comfort are up to mark , but lack of driving pleasure , the moment to start ur car it has different annoying sound (ignitation starts ) one gear down car so it's not smooth at all for city drive , how come MG forget to give turning lights ( heavily required) , suspension too not so good makes sound on impact with bad roads , internet is too slow n does not wrk while driving so less of use , looks n outer build are strong but if u love smooth driving avoid it . Only few voice commands fulfil by Mg so again u feel trapped , even ur diesel variant as no automatic so u can't even switch on the Ac before u start your drive , ahh best thing Panaromic sunroof n huge space overall","August 31, 2019",3,carwale.com
"This car is true suv with a smart voice assistant system. The engine is much powerful then other SUV's in same price range. The Hector have a large panoramic sunroof in which at least 3 kids can stand easily. The fuel economy is low as compared to some famous SUV's in India like duster and creta. The boot space is quite good. It's trunk is very large and we can put up to 5 suitcase without removing the compartment which is present in trunk. The glimpse of car is enough to make anyone love it. Overall,it's it is a good car with comfortable seat.","July 22, 2019",5,carwale.com
My Dream My Self Car MG Hector Traval With My Family at Hill Station Thanks For MG Hector Staff To Provide This Service. It is family Member of my home,"July 04, 2019",4,carwale.com
The buying experience was awesome the staff of the company welcomed us in a decent manner and there were lots of extra offers with the product my riding experience was awesome as I have drived Scorpio first but when I drive mg hector it was a quite luxury experience I had drive. 300 km till now and promisely it is just fab I think there are no cons for this car,"July 20, 2019",5,carwale.com
This car was amazing. I like an I love this car. Compared to car prize was almost nice. An in a budget. Car look is so lovely. An so comfortable for seating. An all facility was so nice.,"August 12, 2019",5,carwale.com
I like this car and i planed for purchase...price is allso good we can afford it...I really happy with this car. I want to purchase and gift this to ma son.dreem car is this I really happy happy happy,"July 05, 2019",5,carwale.com
"Its really internet Car ,Superb looking car nd great pickup thanks to Fiat engine Interior So Unique and next level looking car Hightech system unique futurostic like a concept car seats are very cusiony nd soft leather using great sound system interior console is better than harrier over all great Come back all the best MG Group.","June 27, 2019",5,carwale.com
Hlo mg your product hector is fire in indian car markit but it creat more fire when you lonch hector in 7 seater varint because of large indian families thanks for a greatful product I am very attract with your voice comand system And boot space is very well for indian familes . And provide autonomas bracking system,"August 12, 2019",5,carwale.com
Very good car mg hector ride safety and suffuly and next generation car and look very very like it dis car colors very pretty car is very long and 5 seater and look in tha road and 300 kms and 5000 kms ride comfortable ride not tension and very long range and low rs car is very nice and osm not fighting all car,"August 09, 2019",5,carwale.com
It is so beautiful and talented young generation car When I ride this car I got so surprised and the interior design is so beautiful And the exterior is awesome design and the rest of your own business and the other hand and the interior design and the interior and exterior view of the car is so beautiful,"August 17, 2019",5,carwale.com
Whatttt a car Hats of f to MG One of the high end car in a reasonable deal No doubt its gona be car of 2019 in india. As i went for booking it has waiting for atlst 6 months. N im eagerly waiting for it. I had a test drive. I got feeling of some high end car. U will think the price is less than other cars but other than that there no compromise in car looks or performance.,"July 05, 2019",5,carwale.com
"Driving Smoothly & Feeling Comfortable while sitting in car. Feeling amazing while sitting in the car. It's features was obviously good with compared with Creta, Harrier, Compass. It's was truly amazing experience","June 29, 2019",5,carwale.com
"LOVELY CAR IT IS, I HAD ALREADY BOOKED SHARP 1.5 DCT PETROL. WILL GET THE DELIVERY AT THE SOONEST AND WILL GIVE MY REVIEW AFTER DRIVING IT FOR FEW KILOMETERS, TILL THAN KINDLY WAIT FOR THE REVIEW TO GET IT FROM ME AND WILL DEFINITELY GIVE THE REVIEW ONCE I DRIVE IT. MAJORLY I LIKED THE 360 CAMERA WHICH IS THE LOVELY FEATURE IN THIS CAR.","August 25, 2019",5,carwale.com
"Hector has been one of the most exciting introduction of 2019.Hector challenges harrier,creta,xuv500 and compass. Overall its good highly recommended .. test drive it for feel the experience .... It's looks damn heavy , performance is much more than I expected ... Nice engine coverings .. more boot space ...","July 20, 2019",5,carwale.com
Actually this is what i was looking for best in class amazing car this is professional car maintain all the need about fetching the driver safety also have and mindblooing interior and the most important the internet car that is just amazing so just love with thus car driving whis vehicle on the road is like just amazing experience,"August 17, 2019",4,carwale.com
This is amezing car in this range superb suv car amezing look and very comfortable really i felt very comfortable and i feel very pleasure when i was drive this car This have good performence on indian road there service is also to good,"July 01, 2019",5,carwale.com
"Really superb car, stunning interior design and out side looks awesome value for money.desiel variant really superb.its available all economic groups, seating capacity 5 members veruly comfortable","August 09, 2019",5,carwale.com
The love is the technology and the features at such price. All in love. This means the real car with tons of specifications and features. And the driving comfort is at its best. Hector means real SUV.,"July 15, 2019",4,carwale.com
Best cars ever i have seened before in my life Its features are unbelievable and voice sensors are also very good and strong network. these have better performance and i love its endurance ccengine its average etc,"August 28, 2019",5,carwale.com
All over this a good suv in this range but the seats are not comfortable than harrier and others otherwise it is very good. My personal experience is good but MG can give some more features to attract the people.,"July 05, 2019",4,carwale.com
My driving experience is very good in mg hector. Good space and very easily change the gears and mg hector performance in highway is awesome. My experience is awesome in mg hector and I am suggest you buy it.,"July 05, 2019",5,carwale.com
"Mg hector is a new member in India. It will make royal life(royal look, good performing and right price at right one). Especially voice control is a good feature. The car will make goodwill on society.","July 22, 2019",4,carwale.com
A very good car Really love it... and my friend getting delivery this car on next week .... this is a marvellous car.. and gang itself like this car so much... we all 'll plan to buy car,"September 04, 2019",5,carwale.com
MG HECTOR IS A BIG BLASTING CAR I REALLY IMPRESSED WITH THIS CAR WORLD 1ST BUDGET SUV CAR SAY AGAIN AND AGAIN I LOVE THIS CAR TOTALLY PEOPLE CREZY WITH THIS CAR JAY HIND LOVE FROM INDIA.,"July 20, 2019",5,carwale.com
It is Nice car with all connectivity and superb features .its nicely drive on road .it is internet connectivity .it has voice feature which work perfectly .,"September 04, 2019",5,carwale.com
Best car that i have ever seen in this price range best exterior and interior awesome engine performance and power Best car that i have ever seen in this price range best exterior and interior awesome engine performance and power Best car that i have ever seen in this price range best exterior and interior awesome engine performance and power Best car that i have ever seen in this price range best exterior and interior awesome engine performance and power,"June 29, 2019",5,carwale.com
This car is new technology and internet car and manufacturers halol Gujarat very nice and looking so great and medium range on this car. So I am impressed this segment launch best international fictional on this internet car.,"July 15, 2019",5,carwale.com
This car is fabulous. Look wise so good and performance also better than other car. This car fuel efficiency is better with 170 BH power engine . This car is really value for money.,"July 03, 2019",5,carwale.com
"Not a 7 seater No hill descent control Spare wheel to be made of alloy Tyres could be more wider Can be upgraded to dual tone wooden coloured dashboard Tailgate ajar warning required Upgrade to dual tone interior Non Availability of:- Ventilated seats, Remote operated fuel tank lid, Rain sensing wipers & Lumbar support 4WD","June 27, 2019",2,carwale.com
Better then all SUV special hector mg is big brand mg provide luxury features mg hector buy person feel then luxury cars riding so comfortable look si so beautiful luxury design seviceing cost is low mg provide all features best SUV in the world all most fully loaded luxury features no cons in mg hector,"August 02, 2019",5,carwale.com
"Hector is an one of the best looking SUV and it is big.. it ride's well on Indian roads.. suspension is very good.. performance of 2.0 engine is good 0-100 takes around 11 second.. Safety features are very good in hector.. from base model itself.. they give (ABS, EBD, ESP, TRACTION CONTROL, HILL HOLD, DUAL AIRBAGS) no other SUV have this many safety features in base model.. Low cost maintenance and 5 years unlimited Kms warranty.. and 60% buy back after 3 years.. gives peace of mind to any customer Pros.. one of the best suv.. undoubtedly... Better than all in segment.. Cons.. looks little bit slim (smaller in width) few colours Fully electric hector would be one blast choice","June 29, 2019",5,carwale.com
I am excited Its amazing car Its Amazing thank You .excellent work Superb look Luxury Look like BMW Can't explain it it's new version Experience good with this car Fabulous Amazing Colour block love it I suggest pls buy this car,"July 11, 2019",4,carwale.com
Super looking..... Nice interior also.... Trusted brand.... 4 air bags... With luxury looking.... Comfortable seating... Affordable price.... Driving is very comfortable because its features... Tyre pressure also monitored by display units and powerful engine... That to mileage also good some what... Sun roof arrangements also good.... Finally I Love this model,"September 15, 2019",5,carwale.com
