Review-Text,Review-Date,Star-Rating,Web-Site
"*Have not bought the car* 2. Riding Experience: To understand Hector properly, you'll have to drive it first. It is a big car and by big I mean bigger than XUV 500(In terms of length) and it's a heavy car. For a brief moment you'll forget about it's weight because of the incredibly light steering wheel but on corners and harder braking scenarios, It's quite evident. The front seats offer adequate under thigh and lower back support but would have loved it better if it had an option to control the lumbar support. The seats keep you in place during turns and is cushioned just right to offer better comfort over prolong periods of driving (Driven 300+kms in a stretch) Rear seats have more than enough headroom and legroom but you might end up wanting a little more under thigh support. I think that is compensated by the option of reclining rear seats which is a really good feature in my opinion. The Sunroof is massive and lets in a lot of light. Only the front portion opens up but is big enough. (Would highly recommend people from not sticking their body out). The suspension is soft and by soft I mean it's really good on uneven surfaces but when driving at highway speeds, it can get a little over wobbly oven sudden undulation. This is why I feel, it's a better car for in city long distance drives. Visibility all around is great except the rear where I find the rear glass a little too small but that is where you can use 360 degree cameras (Really helpful in tight parking spots) though the quality of the camera is not even close to being the level needed in a 20L+ car. The screen is BIG and has tons of features (Watch online videos for indepth) In short, it's good but laggy and annoying at times. In built TOM TOM maps is bad and not updated. Thank god the car has Apple Play and Android Auto, GOOGLE MAPS to the rescue. I think the best way to describe the cabin of Hector is that it's looks premium, first impression will be of a really high end expensive car but after sometime, the quality feels lacking and straight off cheap. No rattling sounds over my test runs but a few owners reported rattles from the sunroof. 3. Details about Looks, Performance, etc.: Looks being a subjective matter, i'll leave it for you to decide but I can give my two points about it: a) The car does not look well proportioned. (From back, looks too narrow, from sides, looks like an MPV due to smaller wheels and weird shaped quarter windows, looks the best from front.) b) The rims are perfectly sized but the tyres is what needs help. Narrow tyres and small side walls look bad with the body bulk on top. It desperately needs thicker and wider tyres. Current ones squeak over every sharpish turn. Not adequate. The 2.0 litre Fait engine is probably the best part about the car. It's punchy and decently refined. Won't leave you wanting more. I was able to get roughly 16 kmpl on highways and 12 ish within the city. Brakes are really good and give a very confidence building feel. Servicing and maintenance: Only time will tell about these factors but MG's 5 year warranty does give a sense of relief to a rather new and unknown brand. Pros: a) Bang for the buck. Feature loaded to the brim. b) Wonderful cruiser. c) Spacious for passengers as well as cargo. d) Very easy to drive. Does not feel big due to the light steering wheel. e) excellent engine. Really good drivability and decent fuel economy. f) Soft suspension offers really comfortable ride in city speeds but definitely not meant to be driven enthusiastically. Cons: a) Misses out on some really obvious features. Auto dimming IRVM, Ventilated seats, etc. b) Laggy screen (really disappointed) c) Overall plushness d) 'SAD' tyres. Needs an upgrade. e) Unknown after sales and service.","October 14, 2019",4,carwale.com
"This is the most value for budget variant, most features are available and with the 12-inch infotainment system, this car is irresistible. Further, I must say this car is a little costly. But even a little cram in budge shouldn't stop you from buying this car. If you have budget problems for 1-2 lakhs you could o with Nissan kicks. I know people think badly of Nissan but trust you'll just love this car. Thanks.","December 13, 2019",5,carwale.com
"If we go for budget, this suv come under budget, and this suv give the best riding facilities, and what a look of headlight and tail lamp. It also takes less maintenance and service, and it has the best suv seen in my life. It has a comfort zone, leather seat and great display. This suv also show terrain facilities.","December 24, 2019",5,carwale.com
The very cheap car I took this car by seeing look but the engine is a very worst clutch problem and service is very. Worst please don't buy this while taking a car they will speak very polite but when I got engine and clutch problem they not even bother about that instead of buying this worst car you better buy nano.,"November 28, 2019",1,carwale.com
"I have purchased a new mg of petrol version I liked everything but the city drive it gives me low mileage. Regarding space and comfort, it's good and feels like a muscular one..",,4,carwale.com
Pros. Looks and interior Cons. Lack of pickup when u accelerate it doesnt reacts and suddenly it reacts. To switch on ac u have to wait in heated car for 30 seconds and than screen turns on and u can switch on a/c. Worst ever owned vehicle. My driver says wagonr is much better than this as far as the pickup is concerned.,"October 11, 2019",1,carwale.com
"Its the best off all in this price segment, MG build with stylish looks awesome, It's premium plush interior and exterior lots of features beat India coming in this price range, It will make big grounds all over the path of miles ahead. I wish to be an MG family member soon. Truly beyond a great honour of pride.","October 02, 2019",5,carwale.com
"Before writing these review I'm a car enthusiast have driven multiple car around the world and I always try to give an honest review, Now coming to the MG hector well do not think this is the same company which once had these fancy convertible and u just have the name, this car is a Chinese car owned by SAIC motors. Now one these car Pros: 1) looks although is vary person t person still it is good 2) Space is best in class (comparing harrier,compass,seltos,Xuv 500) Cons: 1) lack of power specially a 2 liter engine car it is shockingly under power with claim 169 bhp where as compass with 171 bhp seems way more powerful and it is surprising even car like ecosport/creta feels way more fun to drive. 2) Ghostly gear change even if you change the gear there is no change rpm for sometimes there is a sound from gearbox I have tested 2 hector and the same thing and these executive from showroom has no idea and they are very arrogent and saying this car has highest booking in india really funny business strategy. 3) Suspension : now that is a scary part, in some large bumps it feels like the parts are moving out similar bumps compass and xuv are running like anything , these is a cluntchy sound in any bump and the executives are saying it is happening is test drive car I really font think any suv with 3000 km should not make such thing. 4) The panoramic sunroof : it is taking long to open and close and especially once open making sound from he top, no way is is even close to compass sunroof. 5) The voice command does not work if there is mild sound outside. 60 The quality of the interior plastic seems cheap compared to the price range 7) The history of Chinese automobiles and their reliability (don't know what that will be in India and how that will go in the future) Final verdict : If you are spending this much increase 1 lakh more and go with Jeep compass limited plus or Mahindra Xuv500 W11(O), I have not tested seltos so can not comment on that else go for ecosport or creta you will spend less and these are value for money. This car is very very over hyped this is at least 8 lakh more than the quality.","October 14, 2019",1,carwale.com
It was nice experience when i drive this beauty first time. starry black color of this car is eye catching. Its exterior looks and interior is also amazing also what to say about its dashboard it gives this car classy look like tesla. Definitely soon this car will be in my collection.,"October 29, 2019",5,carwale.com
"One of the great buying experience. Modern as well as the antique design of showroom and supportive staff makes your experience superb. Riding is all about comfort. Performs ordinary. Maintenance is okay. Pros- looks, comfort, fuel efficiency. Cons- engine, body roll But it's a great pride to have a hector in your garage.","October 11, 2019",5,carwale.com
"It is the best car. And best for Indian roads. it is best to ground clearance, this car looks like Volvo XC90 good performance, maintenance-free car good and best car in 2019","December 02, 2019",5,carwale.com
Need to look for mileage and driving comfort Need to improve on connectivity Good looking and good internet car Look very different and smart in comparison to another car Avg car to buy,"September 23, 2019",1,carwale.com
When you ride this car feel A luxurious brand. my personal way forget other cars in that Price When Generate turbo power car like a bullet Suspension awesome no cabin noise visibility also best,"October 11, 2019",5,carwale.com
This is an amazing car. Everyone should purchase this car. Driver sit is so confortable. Its engine power is too good. Features of this car are amazing. The airbag is also available in this car.,"November 04, 2019",5,carwale.com
"Missing Automatic Diesel Variant. Otherwise, The Hector is true internet car & premium Car as well but still, there is some minor scope of improvement.1-The wheels can be changed from 215/60/R17 to 235/65/R17 or 235/65/R18. 2-The back of hector is very calm & flat it needs designer improvement inoculating a horizontal chrome plate. Please bring Diesel Automatic transmission.","November 07, 2019",4,carwale.com
It was good buying experience I received the car previous months and took it to a long drive to Mumbai and its riding experience is just awesome. I had not sent it to servicing till yet but I still think that service and maintenance would be good.,"October 14, 2019",4,carwale.com
Superb car and this most very powerful car is the best of new generation and is the now also do the work on mobile then it is easily to drive the car and is the known as new car of the india,"November 04, 2019",5,carwale.com
Awesome car super design awesome interior and exterior milage was good driving experience makes heaven feel cost is low compared to other companies overall experience makes a awesome feeling,"October 04, 2019",4,carwale.com
"Starting with the most impressive powertrain in the MG Hector, the petrol hybrid. Despite its capacity, the motor shows a likeable eagerness to build speed. It's a torquey engine and doesn't seem underpowered even if you stick it in a higher gear than necessary While MG isn't unreliable, it isn't as reliable as some of its rivals. Renault has been consistently reliable, and have been like that for some time. ... If you are looking for an affordable car that is good to drive, is practical and more reliable than many brands, then you won't go too wrong looking at an MG.","December 21, 2019",4,carwale.com
Shandaar gari. Super car Ek no. Gari Dekne me mast he chalai to ni he but gari achi dik rhi he kota me abi koi showroom ni he to hum dek na ske jald kota me showroom dalo jisse hm dek sake le ske jaipur bhut dur he to hme badi pareshani aati service me kota me showroom hoga tab lene ki sochenge ok ok,"October 18, 2019",5,carwale.com
Its a nice car with cool features.the car is value worthy.the features are really smart.performance is excellent.it is fully comfort amd exterior is cool.the design of lights are really nice,"October 08, 2019",5,carwale.com
All the above services i like in this MG Hector 1.Buying Experience 2.Riding Experience 3. Looks are awesome too see and to drive also it's a Great Experience 4. Servicing and Maintenance is Super 5.pros and Cons are Good It's too good and in this car MG Hector Hybrid There is Good Safety Measures Why because in this car having 6 Airbags its Great I love This First Internet Car,"October 11, 2019",5,carwale.com
Best SUV as per Indian road condition. Such an internet car. Flagship brand in the market. New age car. Sunroof and other operating systems are so nice. Boot space is enough. Colour is vibrant. The touchscreen display is so wide and best. 360 angle camera feature is good. At least leading car in the Indian market,"November 04, 2019",5,carwale.com
The car is fabulous and it's interior space is also manged well soo the customer get good boot space and company also gives you buy back offer soo now you can use the car for 3 yeas nd you can give it back to the company at 60% value but I m not sure about its service. It's a fully loaded with all modern features and it's best in this segment and price tag. I hope it will also good. Thank you,"September 28, 2019",4,carwale.com
True internet & a premium car.But Missing Automatic Diesel Transmission.There is still scope of improvement ie-1-The wheels can be change from 215/60/R17 to either 235/65/R17 or 235/65/R18. 2- The back of Hector is calm & flat this might have been more fascinating by inoculating a horizontal designer chrome plate.,"November 07, 2019",4,carwale.com
Some day I will drive it..It's really a human thing..I have been in love with this car ever since I have seen it..An outstanding product at very low price..Can't believe it.. All features are amazing to see.No one can beat the MG Hector.. Terrific product and quality..It's really a value for money. One must buy to feel the difference in drive..,"October 15, 2019",5,carwale.com
I have used a Swift car. I sale my Swift car. Than I buy my M. G Hector. Ites my dream car also. Mst car in SUV cars. It's so costly but it's my dream car also. Thanks for this car,,5,carwale.com
It's a very stylist car and it's gives a very comfortable and luxurious feel while Driving . Price of car is very genuine According to their features and Comfortability of this car,"October 07, 2019",5,carwale.com
"I have not buy this car but i can definitely say that overall quality and features are so good. Ride quality is so smooth, in terms of look mg hector is an attention graber in market and a full feature loaded and power pack hunk suv. Its not so efficient in mileage but its average in comperison of other rivels in the market.","October 19, 2019",4,carwale.com
Very good comfortable nice looking Good riding Great performance Service best Engine powerful braking system powerful Suspension grade Voice command features very nice And powerful song system,"October 05, 2019",5,carwale.com
Very comfortable car and good looking design .car interior side very awesome and stylish design .this car speakers are very good cars is also internet and mobile connected this car is fully technology loded,"October 12, 2019",4,carwale.com
"i love this car and design this is my dream car ,i want gifted this car my father,beacause he also love this car and buy it ,,so i want buy this car as soon as possible, and I'll complete my dreams....","October 15, 2019",5,carwale.com
Service while buying the car was nice. Employee have given their best to treat us well. Riding is also good. Performance is great. No maintenance yet. Only one drawback is the ground clearance.,"October 23, 2019",5,carwale.com
when government is rolling out BS6 by April 2020 another 4 months left is it advisable to buy MG hector with BS4 ? New car will loose it's value by 50% post April 2020. Why MG taking booking for BS4? Is customer is taken for a jolly ride here ?,"December 04, 2019",4,carwale.com
It gives smooth driving and excellent comfort.this was an excellent car in this price range and main feature as it is connected with internet I love this car when I compared with other cars,"October 09, 2019",4,carwale.com
"A class within a affordable price tag, one can feel the comfort with elegance styling and unique interior and exterior design. A specious vehicle with great comfort in driving, brings you smooth transmission and latest security features. A must own car in current market segments.","October 30, 2019",5,carwale.com
When buying the staff was very good to us and I got my first service after the service vehicle is running very smoothly not too high maintenance I have scorpio but the nothing can beat mg hector ride quality all the material used is looks rich and expensive but the quality of 360 degree camera is nit that good . Improve voice commands and infotainment system,"September 23, 2019",4,carwale.com
"This is a wonderful car which has all facilities and buying experience is very good and riding experience is also very good and details about look ,performence are look is very nice and performence is very very good and maintanence is very importanat because we should keep our car very clean that means only even a maruti car will look nice and that's all about the car . Thank you !!!","November 16, 2019",5,carwale.com
It was a very easy process for buying it . There is not anything bad about the riding experience although it was very smooth and comfortable. The looks are awesome and the performance is also very good . The maintenance cost is also not too high . Service centres are not many as it is a newly established brand in India . The are a pit of things that are ignorable like the engine sound in the cabin,"December 08, 2019",5,carwale.com
"This car is value for money gives lot of comfort while traveling the features is exellent ,the touchscreen display contains lot of features,internet inside is best in class feature at given price point","December 04, 2019",5,carwale.com
"This car is extremely excited . this car look good. This car Amazing fichars give like a Sunroof, electric parkingmode, inbild 4g sim loded, car balance systm ,dct transmition, etc....","November 16, 2019",5,carwale.com
"We have an Indian car I.e. Mahindra xuv500 which has hill descent control also in this segment, I want to add new features as wireless charging, led screen for passengers and hill decent control to this car as Hector. Now every customer go to carwale to compare his wish list so next time keep updated.","October 03, 2019",3,carwale.com
Value for money Best in segment Best features given Engine performance best i am not drive but as pr discussion with friends it was good experience. Exterier & interior look is great. Also service centers available.,,5,carwale.com
The MG Hector really amazing car. It give amazing experience to drive and giving more features. The company was give more features in less money. The car amazing experience of SuV. The pickup also smoothness and it also hybrid technology. At 60 to 80 the car is at electric + petrol. There is some jurk.,"November 02, 2019",5,carwale.com
"Its amazing car with best comfert nd best interior with big screen nd loaded with all feature awarsome car Maintance is gud for this car Pros:great engine ,luxury seats, big screen internet car value for money best sunroof Cons: to much waiting time ,","November 13, 2019",5,carwale.com
Want a Car Get MG Hector The defined car.... ! When you think about a car Think most about MG Hector Really it is redefined and refined. The car is so much sophisticated than any other car. Now we can add pride to our life by owning MG Hector. Really I am proud to add the pride of owning this car which is the valuable dream of me...,"October 23, 2019",5,carwale.com
It is a perfect car for me. I want to buy this car in black colour but i dont have the money to buy now but one day i will buy it. It rides so smooth. It looks like a hulk i love each and everything about the car its my dream car.,"November 02, 2019",5,carwale.com
This car was amazing....the function and convenience of this car is quite impressive...I will be bringing a new car soon and I am confident that I will choose the mg hector. This if so pretty...!,"September 30, 2019",5,carwale.com
1. My buying experience was soo good 2. Riding experience and comfort is extraordinary even I have my toyota fortuner but now due to comfort I prefer mg hector over fortuner 3. As everyone can see the look of this car awesome and latest design. In terms of performance the performance and power is not good as my fortuner but it’s good for a 1.5 L engine that you can expect for an engine like that over its value for every penny that you pay 4.Since it’s a new car I don’t know about the service and maintenance but I think so the cost of the service will be reasonable price But in showroom they told the service cost will not be more expensive 5. It’s over all a great car as expected But some more specifications are missing and low fuel economy,"November 05, 2019",5,carwale.com
"Superb car.
Amazing drive and great looks.","Dec 09, 2019",3,cardekho.com
"Great build quality and spacious.
As I shut the door of the Hector, the door's thud surprised me. It is a solid car. The acceleration was decent and the power delivery is great. The space in the back seat is amazing. The quality is top-notch as you expect from a 20+ lac car. The thing that annoyed me is the screen, it's laggy. The basic functions like the A.C. and the 360 camera se...Read More","Dec 05, 2019",3,cardekho.com
"Amazing machine.
People say that the electronics won't work out in India but MG has proved almost everyone wrong. Speaking of electronics, the car is fully loaded with advanced technology and none of them feels like it's overdone. My second point is the mileage, Hector is an SUV but still offers great mileage of around 16kmpl. The dimensions of the car are humungou...Read More","Nov 28, 2019",2,cardekho.com
"The Best
MG Hector is a very experienced vehicle. It is made by Morris Garages (Mg) Hector. Its budget is very low and has advanced features. Its massive sunroof gives a pleasant feel to the cabin. Its touch screen is also controlled by voice. Its leg space is massive. Its price starts from 12.17 lakh. I really want to buy this car. Read More","Nov 29, 2019",3,cardekho.com
"Amazing machine.
Can't comment over the engine quality because British cars are amazing in quality check. Build quality and features are also good.","Nov 29, 2019",3,cardekho.com
"Ok car to buy
The car is good on cosmetics but I don't think that you can trust the engine for the long run. MG still needs to take care and refine the engine according to Indian road conditions. Giving a variety of features won't help if there is an issue in engine quality. The mileage is also very less and gives 7 KMPL on the highways. Read More","Nov 24, 2019",2,cardekho.com
"Overrated car
This car is overrated and doesn't match the hype it created. It doesn't have a good ride quality. ","Nov 20, 2019",2,cardekho.com
"Best In Segment Car
Good Looking and best in the segment. The company is based in China and the UK basically. Talking about build quality & crash test rating, Let me tell you that, it got 5 stars in the China NCAP crash test. It offers many features at this price range. It Strongly competes with Tata Harier & KIA Seltos. Read More","Nov 16, 2019",3,cardekho.com
"Good Driving Experience
I have been driving MG Hector, Petrol, DCT Car for the last 3 months. I am thoroughly disappointed with fuel efficiency. City driving is between 5 to 6 km which is nowhere near the declared fuel efficiency of 13+ km. Highway driving FE is not more than 9kms. Moreover, there is a lag in DCT when you accelerate. VW TSI is the best in automatic transm...Read More","Oct 14, 2019",3,cardekho.com
"Worst Product
The MG Hector looks good and is tempting to buy as it offers a lot of great features at a significantly low price but the car has a severe problem which consumers may not come across very soon but some or the other day they may face many problems. The car's clutch plates are burning off. Read More","Sep 25, 2019",1,cardekho.com
"A New Generation XUV
Took a test drive of MG Hector. The driving experience was ok. Actual AC controller is what a customer likes because voice command is not upto the mark. Camera clarity was awful. Seemed like a gimmick. Comfort level was good. But this car comes with offers which Indian customer loves.  Read More","Sep 25, 2019",3,cardekho.com
"Worst Car
It would be best if you name it as a china toy car. It has many problems, please no one buy the car and waste your money. The clutch plates will get burnt if you drive for more time in traffic, for diesel, there are fuel pump problems, All the parts are exported from China. Read More","Aug 25, 2019",1,cardekho.com
"Cheap Quality;
MG Hector cant be the segment leader just because of low price and this car is not offering things up to the mark, as the car is offering low quality at low price and this is very disappointing. Either u raise ur standard quality and charge more money or must stop selling this cheap product. Read More","Aug 22, 2019",1,cardekho.com
"Bad Quality;
I think  MG Hector need more time to set in India and Kia Seltos is best in comparison with it.","Aug 22, 2019",1,cardekho.com
"Poor Quality Interiors;
  MG Hector is having poor quality interiors, bad ride quality such as body roll. Engine lacks a punch comparing the size of the car feels very underpowered, exteriors are good and eye-catchy Read More","Aug 22, 2019",1,cardekho.com
"Not So Good Car - MG Hector
Touch response is not that good as compared to variants sold outside India and the interior is nice not the best and I did not like the design as it looks like a rectangular box as and it is not appealing as other competitors in the segment as well as the Kia Seltos which has made its debut in India. I think Seltos will gain more buyers than Hector...Read More","Aug 20, 2019",3,cardekho.com
